### ISSUE TITLE
MQTT: "Connect failed: Socket is not connected" on plain port 1883 with TLS off (macOS)

### ISSUE THREAD

**Issue by vu2cpl** [ten9876/AetherSDR#1348]
### Report preparation

- [ ] I used the AI-assisted bug report tool (Help → Support → File an Issue)
- [ ] I have attached a support bundle or log file

### What happened?

Description:
MQTT fails to connect to a known-working Mosquitto broker on port 1883 with TLS disabled. The broker is reachable and all other MQTT clients (MQTT Explorer, Node-RED, multiple IoT devices) connect successfully on the same credentials.
Environment:

AetherSDR version: v0.8.11
OS: macOS (on Mac Mini M4 Pro)
Broker: Mosquitto 2.x on Raspberry Pi 4 (192.168.1.169)
Broker port: 1883, plain MQTT, allow_anonymous true

MQTT Settings in AetherSDR:

Host: 192.168.1.169
Port: 1883
TLS: OFF
User/Pass: blank

Error shown: Connect failed: Socket is not connected
What tcpdump shows on the broker Pi:
AetherSDR IS reaching the broker at TCP level but immediately resets after the SYN-ACK:
192.168.1.157 > 192.168.1.169.1883: Flags [SEW]  ← SYN
192.168.1.169 > 192.168.1.157.1883: Flags [S.E]  ← SYN-ACK (broker accepts)
192.168.1.157 > 192.168.1.169.1883: Flags [R]    ← RST (AetherSDR kills it)
This repeats every ~4-5 seconds. Mosquitto logs show zero connection attempts — the RST happens before the MQTT handshake.
Also tested:

Port 8883 with TLS ON + self-signed CA cert → TLS setup failed: Invalid input
Port 8883 with TLS ON + CA cert trusted in macOS Keychain → same error
All other MQTT clients connect fine to same broker

Suspected cause: libmosquitto TLS path validation may be running even when TLS is toggled off, causing immediate RST. Or a macOS-specific socket initialisation issue in the bundled libmosquitto.

### What did you expect?

MQTT to connect to a known working broker.

### Steps to reproduce

Run AetherSDR
Select MQTT>host IP and port 1883, TLS off , Click ON. 
It says Connect failed: Socket is not connected.

**Comment by vu2cpl** [comment]
Running 0.8.12 from the repository as binary for macOS arm silicon. TLS is not important if aether can connect 1883 port.
